reviewId,userName,userImage,content,score,thumbsUpCount,reviewCreatedVersion,at,replyContent,repliedAt,appVersion
a319427a-453d-49aa-a742-a262c63f9f35,Hanni Imanniar Rozana,https://play-lh.googleusercontent.com/a/ACg8ocKjwsBo_KFzIskeNZ1Wr3-qQgz_O6jl9Sy-jaWoP-V8tqh_VQ=mo,tolong perbaiki aplikasinya suka buffering padahal sinyal baik baik saja,3,0,12.4.7,2022-12-15 16:18:55,"Hai, agar kami dapat membantu mohon kirimkan email kepada kami di disneyplus.id@hotstar.com berisikan nomor telepon yang terdaftar dan nama provider jaringan yang kamu gunakan serta merek dan OS perangkat yang kamu gunakan dan foto kendala yang kamu alami. Terima kasih.",2022-12-16 13:46:57,12.4.7
8ebf14d9-cabc-47ee-941c-982a250b7afa,Mayriska Utami,https://play-lh.googleusercontent.com/a-/ALV-UjXZ6pPqE3d7NWTzaYQqprt5F7WTsoKS6lNIrjtuz7LI_ekQuHk,"Di handphone saya selalu gak bisa Terjadi masalah DRM, sudah hubungi melalui email tetapi responnya lambat",1,3,12.4.9,2022-12-15 16:02:36,,,12.4.9
7e6f6dbe-ee74-4dfe-a45f-a7f7533b4336,Andi Alfin,https://play-lh.googleusercontent.com/a/ACg8ocJXtzJsMOdr-WXq_XtXEcMO6f18X0jDOc0txqwP0Ji7mAXCDA=mo,"aplikasi yang sangat jelek, drama belum di download tapi muncul tulisan sudah di download, sangat payah",1,0,12.4.9,2022-12-15 15:43:47,"Hai, mohon kirimkan email di disneyplus.id@hotstar.com dengan menyertakan nomor telepon yang terdaftar di Disney+ Hotstar, merek dan versi OS perangkat, versi aplikasi, screenshot kendala dialami, nama jaringan yang digunakan, dan konten yang mengalami kendala. Terima kasih.",2022-12-19 14:40:38,12.4.9
a3f62ca3-931d-4158-b9e0-cbeac166c737,Waone 1124,https://play-lh.googleusercontent.com/a-/ALV-UjX4temauyaw_GX4RlEV5zkMxxDrpx9MOYXSkCuAXGvWsOYFNicf,"Kenapa menu subtitle film bahasa Indonesia hasil download film offline menghilang..? padahal jika di tonton online subtitle bahasa Indonesia tersedia..! Ini sangat merugikan pengguna, sudah susah payah mengunduh ,malah subtitle bahasa indonesia di tiadakan,apa iya harus hapus hasil download untuk menikmati film bersubtitel bahasa Indonesia,nah gak etis kan?? Mohon di koreksi bila saya salah..!!",3,0,12.4.7,2022-12-15 14:49:57,"Hai Waone, kami memohon maaf atas ketidaknyamanan yang dialami. Silahkan email kami di disneyplus.id@hotstar.com disertai info perangkat yang digunakan (jenis/model), versi OS dan screenshot kendala (jika ada) agar kami dapat menindak lanjutinya. Terima kasih.",2022-12-15 14:32:04,12.4.7
44974901-4f6c-4503-93c1-bf5b8f53e056,CUKONK RIMALANK,https://play-lh.googleusercontent.com/a-/ALV-UjX7L-7Qo3ys07Otrnp42-2uAOdHehsl45lNnTNPZatFizb3z3Yb,Bangsaatt sudah didonload malah tidak bisa di tonton,1,0,,2022-12-15 10:52:40,,,
bdea7ea4-b6c3-4543-9e76-3a55d61772cd,Mike Wowor,https://play-lh.googleusercontent.com/a-/ALV-UjVao8QgfFFkZNYc4mcXHiDaW4AjVSkyfMKhdC6Xyfy7NYJ7odKM2A,Min Lalod..,3,0,12.4.9,2022-12-15 10:36:39,,,12.4.9
6c3088fb-49fb-444e-af34-f3e44d25d28f,ikanuralfi hardiana,https://play-lh.googleusercontent.com/a/ACg8ocKRQGMN9CP56mmsnI0pGSpN6KuNqzP_FRRuU7cr9-cQhkBGkQ=mo,"Masih berlangganan 1 bulan tapi buat nonton sudah gak bisa ?? Tolong tingkatkan lagi , rugi kalo kaya gini",2,0,12.4.7,2022-12-15 09:23:14,"Hai Ikanuralfi, silahkan kirimkan email kepada kami dengan nomor langganan kamu dan screenshot nomor ID kamu di disneyplus.id@hotstar.com uraikan kendala yang anda alami dan kami akan membantu kamu secepat mungkin. Terima kasih.",2022-12-15 15:12:17,12.4.7
b9dacad7-e8f7-4f91-b4fc-86ef6384b9db,Nadia Syahputri,https://play-lh.googleusercontent.com/a/ACg8ocKYWLDHCwYCp1SMvS-Mh0tPUgv_8qvz891Uv5MR5kfP9hea4g=mo,"Lumayan menghibur sih, tp untuk pencarian susah banget nemuin yg pengen di tonton🥲",3,0,12.4.7,2022-12-15 09:07:45,,,12.4.7
6ba35aa3-ff01-4b4b-ba67-4cf9600637ba,THE READ,https://play-lh.googleusercontent.com/a-/ALV-UjVxG5fKNQuMMVzvPTDsK5Ocxk2SzRlC_1-YsNel1uk_CzE6sE0,Knapa harus berlanggan saya tidak. Punya uang buat beranggapan Tolong jangan berlanggan,4,0,,2022-12-15 08:40:58,,,
c050f390-8487-4b7e-8da7-476efb3734f2,Manusia Dunia,https://play-lh.googleusercontent.com/a/ACg8ocKFyWaH5_pxEN7CwEpsKQoFgySEDkL_GWF4pxun9xmMt2ldOA=mo,Stuck loading apk jelek,1,0,12.4.9,2022-12-15 08:13:14,,,12.4.9
4a6d3efc-4465-4b21-afa9-27c298235b43,yasir subarkah,https://play-lh.googleusercontent.com/a-/ALV-UjV7yy-Ih2D4HDagp0U0m51c9cX5ufZqsARtJAPxpDymqbK39lBQ,",N",2,0,,2022-12-15 04:37:50,,,
06dc7296-b940-4642-b2de-81c0cb494dbf,Maria Tabitha,https://play-lh.googleusercontent.com/a-/ALV-UjXo1H0sIi98AG3TNqPH32p4o2idFxOheFzKnQOxDic5dSt4i0YJ,"Tidak dapat memasukam kode otp nyesel ,,bantuin dong gimana caranya bisa streaming lagi di tv udah bayar mahal.",1,0,12.4.7,2022-12-15 00:46:13,"Hai Maria, kami mohon maaf atas kendala yang kamu alami. Mohon untuk memeriksa koneksi jaringan telepon kamu dan pastikan bahwa nomor telepon yang dimasukkan adalah benar. Jika kendala masih berlanjut, restart ponsel kamu dan coba log in kembali. Kamu juga boleh memilih opsi lewat IVR untuk menerima OTP. Terima kasih.",2022-12-15 14:19:15,12.4.7
6df660e6-aacf-42f5-a939-dc6251a1eb1f,Budi Darmawan,https://play-lh.googleusercontent.com/a/ACg8ocLp_6EJKypFQ_oVkADhrKAf0c0MuDatGRT65XRY8EtMvnRb4Jo=mo,Kasih 3 bintang dl ya. Film2 nya di perbanyak dan di perbaharui..,3,0,12.4.7,2022-12-14 23:38:16,,,12.4.7
7de770f3-718f-4cfd-8510-7bd890df86b1,Yojo Kodi,https://play-lh.googleusercontent.com/a/ACg8ocKLAG_LIMqiomxi1BW88G6iPGUsD2_IHo0Ejz9X-6Uwg1-nVw=mo,apk ap in tailasu,1,0,25.09.08.1,2025-10-06 01:24:39,,,25.09.08.1
45625263-c894-4276-95ca-90a1826b73e5,Benghi Benghi,https://play-lh.googleusercontent.com/a/ACg8ocLg9IzdqQ2xsABQrz0fvQMFpLkw2TpgMYaPXLK-yc0xZ2h3sQ=mo,aplikasi ini telalu rumit,1,0,25.09.08.1,2025-10-06 00:21:55,,,25.09.08.1
a54c4e55-9042-47bc-8320-c12b421d7d98,Rhania Fawazi,https://play-lh.googleusercontent.com/a/ACg8ocKQcpxiUo6L5TYmVQ0Rzlwb9XSDmJC0AS4pidZNYchdpaiyZw=mo,sejauh pengalaman ku ini bagus apalagi biaya berlangganan nya juga worth it harga 65 an dengan Grafik 1080 full HD walau memang Masih ada kekurangan tapi Overall menurut ku bagus Dan mayoritas Film-Film nya ada bahasa Indonesia,5,0,,2025-10-05 19:06:56,,,
15912d6c-bbb6-47f3-a89d-ba178516e26a,Pathor Gaul89,https://play-lh.googleusercontent.com/a/ACg8ocJcZGmB6Z1SJppYkvzzRszPCV7GYkBT8GnLYe0A4aru2bQ1Aw=mo,indonesia,5,0,,2025-10-05 15:55:29,,,
7b2d743e-99a2-4000-bd0b-afa6ce7effe3,Mustofa Ali Alhamid,https://play-lh.googleusercontent.com/a-/ALV-UjXyXlHMDXQ7J1bDLqZRq_UI-tLGaobU4pWyc44xldg5XeSh-Rit,halo saya minta tolong hadirkan judul H2O: Just Add Water dan Mako mermaids dan early edition😭😭😭😭😭🙏🏻🙏🏻🙏🏻🙏🏻🙏🏻🙏🏻 karena saya belum nonton ini sampai tamat.... please... please.... please😭😭😭🙏🏻🙏🏻🙏🏻🙏🏻🙏🏻,4,32,25.09.08.1,2025-10-05 09:03:54,,,25.09.08.1
9697ec6c-f9a8-454b-9ddb-e7faa7671a84,Izi rhomadon Rhomadon,https://play-lh.googleusercontent.com/a/ACg8ocJJmqfBcqhzlXmDstoFrIANmx5gP7ngHHP5Odpmf__fe0-BaQ=mo,ok,1,0,,2025-10-05 04:53:36,,,
a4a8ec50-4572-4956-8919-bc04baa92284,Eko Rachmat,https://play-lh.googleusercontent.com/a/ACg8ocJhq-XHXaNYyBgCozgkO95iYd4S_JgjbyXSkhS6NAgU66Fqog=mo,Tolong lengkapi dengan pilihan warna subtitle dong,5,0,,2025-10-04 20:37:30,,,
6e17fcd5-615d-459a-8c56-8a46a4789d52,Eka Eka,https://play-lh.googleusercontent.com/a/ACg8ocJI8NscdZCO7ak1wcupAIGoeJhJC82hiWbpwMReDKQ-WHU_ew=mo,sangat bagus walaupun kemarin ada masalah klau nonton layar hitam tpi sekarang udah kembali normal di selesaikan sama admin nya klau ada masalah di hubungi admin nya kirim ke email lapor masalah nya di email pasti bakal di bantu sama admin nya,5,5,25.09.08.1,2025-10-04 20:36:30,,,25.09.08.1
19371ca5-d2df-4780-8f8e-4437e95a64d0,aiurs,https://play-lh.googleusercontent.com/a-/ALV-UjUI2EO65nlThnIxZueG06uk0G9Ie8eItD3fQKAZL2ZSnzdYE98,boi,1,0,,2025-10-04 11:15:13,,,
bd3d30b6-5f8f-4634-98ee-f2bd60383d65,Muhammad Alfin,https://play-lh.googleusercontent.com/a/ACg8ocIm0FJBOIlUCdtCNLwOoqoQSjgh3G_QWbB3zGCgCXETI6yv6Q=mo,buruk sumpah saya udah langganan malah gak muncul gambar nya signal stabil gambar tidak muncul bikin rugi pelanggan aja,1,0,25.09.08.1,2025-10-04 01:18:25,"Hai Alfin, kami mengerti atas ketidaknyamanannya. Mohon kirimkan rinciannya ke email disneyplus.id@hotstar.com disertai nomor telepon yang terdaftar di Disney+ Hotstar, merek, model & versi OS perangkat, versi aplikasi Disney+ Hotstar, nama konten, foto/video pendek kendala, dan nama provider internet kamu untuk bantuan lebih lanjut. Terima kasih.",2025-10-04 16:47:32,25.09.08.1
3fda6f64-8de5-416e-8355-02ae91d851b8,Elisabeth Elisabeth,https://play-lh.googleusercontent.com/a/ACg8ocKcSG9wJBRMmdJj9fttq8Fk-npSj9Xzb1b48HIDHWPpoJUL4g=mo,"aneh, gambarnya hitam semua, cuma keluar suara aja",1,0,25.09.08.1,2025-10-03 23:14:13,"Hai Elisabeth, mohon maaf atas ketidaknyamanannya. Kamu dapat mengirimkan rincian kendala kamu disertai nomor telepon yang terdaftar di Disney+ Hotstar, merek & model perangkat, video pendek dari kendala, judul konten yang terkendala, nama provider jaringan internet yang digunakan ke email Disneyplus.id@hotstar.com. Terima kasih.",2025-10-04 16:32:31,25.09.08.1
368fe2ed-cd26-4941-ad38-853e1f010735,magi 13th,https://play-lh.googleusercontent.com/a/ACg8ocL_-6585UU71HX4m-PtAoIuAgmId1rdZiTqBvifeh7Niw6cQiU=mo,makin ga jelas aplikasinnya ke t*i,1,2,25.09.08.1,2025-10-03 20:30:42,,,25.09.08.1
3ae371ad-6b33-4c00-9bd4-a9a8ab161f41,Adi Sudanta,https://play-lh.googleusercontent.com/a/ACg8ocLCg-Y1opnBC8aT4MEAFcsAMw1N74ihSir2zrkskh9mK2YOAw=mo,vidio kadang ndak muncul bikin rugi aja,1,0,,2025-10-03 19:51:05,"Hai Adi, mohon maaf atas ketidaknyamanannya. Kamu dapat mengirimkan nomor telepon berlangganan Disney+ Hotstar, model perangkat, versi OS, versi aplikasi Disney+ Hotstar, video pendek dari kendala, nama konten yang terkendala & nama provider ke email kami Disneyplus.id@hotstar.com. Terima kasih",2025-10-04 13:45:06,
5243af18-b719-439c-99e4-ae8713adebfb,Shafira Nur,https://play-lh.googleusercontent.com/a-/ALV-UjWEb0dCuZThCsnC91ENg1yOYTuh_dtNWmq5WPUrB8XwF5TvUANm,okelah,1,0,25.09.08.1,2025-10-03 16:20:27,,,25.09.08.1
a209d517-fa6f-49c6-a238-9f6e13661421,Fahmi Aziz Narendra Suhono,https://play-lh.googleusercontent.com/a-/ALV-UjW4mdsYc8RLHabe8LVhfoTrUYPAwc2mxTv1oKw-3cYiVyilU8o,"tolong dong ini saya udah download film nya tapi masih buffering tuh gimana ceritanya ya, tolong segera di fix.",3,0,25.09.08.1,2025-10-03 09:13:20,"Hai, mohon maaf atas ketidaknyamanannya. Kamu dapat mengirimkan nomor telepon berlangganan Disney+ Hotstar, merek & model perangkat, versi OS, versi aplikasi, video pendek dari kendala, judul konten, dan nama provider internet ke email kami Disneyplus.id@hotstar.com. Terima kasih.",2025-10-03 13:40:14,25.09.08.1
627c9610-c6e7-41c5-8ee7-438a1561c006,Dyah Ajeng Putri,https://play-lh.googleusercontent.com/a-/ALV-UjWWm--zJkHsSZN8Pw4c27Yzog_Nf9oWeKl11gxRzMbq7jCKJFgk,"Disney parah banget ampun dah, video nya ngelag terus, habis itu muncul layar hitam atau gak layarnya kedip"" terus...udah 3 hari gak ada pembenahan sama sekali",1,5,25.09.08.1,2025-10-03 09:05:52,"Hai, mohon maaf atas ketidaknyamanannya. Mohon kirimkan email kepada kami di disneyplus.id@hotstar.com dengan nomor telepon langganan kamu, detail perangkat (merek, model & versi OS), versi Aplikasi Disney+ Hotstar, nama konten, nama penyedia jaringan internet, dan video pendek kendala yang dialami sehingga kami dapat membantu kamu. Terima kasih.",2025-10-03 14:48:55,25.09.08.1
ed4205c7-9665-4632-8be8-ee69d5c15aae,Pande S,https://play-lh.googleusercontent.com/a-/ALV-UjUMlGwjSFRqNYirOszrvCWIv9G3v9UtuIb05yv_yyAaG6YgooXh,film blank. terputus,1,0,25.09.08.1,2025-10-03 08:21:10,"Hai Pande, kami mohon maaf atas ketidaknyamanannya. Mohon informasikan kepada kami rincian kendala kamu melalui email di disneyplus.id@hotstar.com beserta nomor telepon yang terdaftar, merek, tipe & versi OS perangkat, versi Aplikasi Disney+ Hotstar, foto kendala, judul konten (season & episode), dan nama penyedia jaringan internet. Terima kasih.",2025-10-03 14:53:30,25.09.08.1
e5a56448-cc4c-432b-a9c2-864d3d0d0e87,Alang Babega,https://play-lh.googleusercontent.com/a-/ALV-UjWBIFUZTnvSDBCHwp4agzY7EPfGvk4gT0rDcyHqfhgfYd7_v9tR,film berbayar,1,0,,2025-10-03 06:36:36,,,
26534422-2882-4021-b55d-2e7dd4287fe7,Fans Elektrik,https://play-lh.googleusercontent.com/a/ACg8ocLM47hZdAVv6tVuNH5U0x8Qb05_AVHSzLeIy3DbvPLsIVMOBA=mo,maaf ya,1,0,,2025-10-02 18:54:49,,,
0f098beb-8775-4be6-8c44-bd3936837f5f,Gilaksih 2022,https://play-lh.googleusercontent.com/a/ACg8ocLfpxa-KqUcqkFKmlGmdg1tqufI3IqJxe9B9PbxEXPmaNaO3A=mo,Nyesel beli bayar mahal tapi layanannya engga sesuai,1,0,,2025-10-02 16:30:32,,,
71f588d5-d2e2-4938-99f0-042fde122ce3,Si Taslim,https://play-lh.googleusercontent.com/a-/ALV-UjX3kuRsxcGm4aI6Ho1xQb8-QwA3HmpA1qjJ-TepeheZ7FoN-wc,streaming nya black screen,1,0,25.09.08.1,2025-10-01 19:11:43,"Hai! Kami mohon maaf atas ketidaknyamanannya. Agar kami dapat membantu melakukan pemeriksaan, mohon email ke disneyplus.id@hotstar.com disertai dengan nomor telepon yang terdaftar di Disney+ Hotstar, merek, tipe & versi OS perangkat, versi Aplikasi Disney+ Hotstar, foto kendala, dan nama provider jaringan internet yang di gunakan. Terima kasih.",2025-10-02 13:57:27,25.09.08.1
7f427712-bfb8-4ac0-99aa-b24ebfd4443e,Jaguar Kyorugi,https://play-lh.googleusercontent.com/a-/ALV-UjVDE1MtLGsdjhOhBOTbwOp5E87qWqO2DOd64X_mo6VBIYKFn-h1ZQ,saya mau tanya baru nonton 2 hari masa layar nya gelap ga bisa nonton hanya keluar audio,1,0,25.09.08.1,2025-09-29 23:23:01,"Hai, mohon maaf atas ketidaknyamanannya. Mohon kirimkan email kepada kami di disneyplus.id@hotstar.com dengan nomor telepon langganan kamu, detail perangkat (merek, model & versi OS), versi Aplikasi Disney+ Hotstar, nama konten, nama penyedia jaringan internet, dan video pendek kendala yang dialami sehingga kami dapat membantu kamu. Terima kasih.",2025-10-01 13:23:17,25.09.08.1
2f93d085-db63-4e22-b24c-cbe5fec5553f,Kahfi Pelara,https://play-lh.googleusercontent.com/a/ACg8ocK8FTStBDap50m2tgOXuvqTaGld0QaiENsW5RfS6jXISdqICQ=mo,TDK sesuai,1,0,,2025-09-29 07:49:40,,,
af4e314e-5895-4f6a-ad8b-cb1a158ea1e5,Ruddy Juventini,https://play-lh.googleusercontent.com/a-/ALV-UjW5innfVEVOcyoTL7uy8ygGTCnhC6iZx__1lnQ6Q8qMvAIJCCo,JANGAN ADA YG DOWNLOAD,1,0,,2025-09-29 02:43:55,,,
ba945127-72d2-4427-b849-702d79a22b91,Wawan Hermawan,https://play-lh.googleusercontent.com/a-/ALV-UjXJTBmLkAkbAgskCx4t1BRT8lz86nDfnlWqC8FbEptrO976ZuIZ,"Pembelian pakai gopay atau bank visa yang aku ga punya, padahal ada fitur qris atau google play yang bisa jangkau banyak orang. Gimana bisa berkembang jika nyusahin orang dan diri sendiri. Murah sih 65k aku bisa beli tapi karena terbatasnya pembayaran, ga jadi beli. UNINSTALL DEH APLIKASI INI, OH IYA ADA BAJAKAN KN DI SHOPEE YG BISA BAYAR PAKE APAPUN",1,30,25.09.08.1,2025-09-29 00:08:58,,,25.09.08.1
321cc1e7-aaa6-407e-a271-3bfbb6be6a1c,Maiezs The gamer,https://play-lh.googleusercontent.com/a-/ALV-UjVJdxHvxyJKlkYlLogihhgWFNrnAN5Y8FrbTMyEpZsd_UFAqvQk,mahal banget sih,1,0,,2025-09-28 08:25:35,,,
7a87f603-6106-47c7-aea1-197119726420,Ali Ridho,https://play-lh.googleusercontent.com/a/ACg8ocJU9BvIhO-q541v0Jswj1XKtWMX01gtkHczW913AQslPvS__A=mo,jijiknya gak jelas buat aplikasi kaya gini,1,0,25.09.08.1,2025-09-27 23:31:38,,,25.09.08.1
b44c9c55-f844-407b-b760-f993db3e65ef,Miftahul Choir,https://play-lh.googleusercontent.com/a-/ALV-UjUm5kWmN03H4Yr2dH9c_EJUKp97xGeBIpWlL8hGJcjv6epbcz8,terlalu ribet,1,0,25.09.08.1,2025-09-27 23:17:53,,,25.09.08.1
bc44ed97-facb-4bf8-9bf4-e7546c9c245e,RISSA Channel,https://play-lh.googleusercontent.com/a/ACg8ocJXhTMZkxd2yliuWoK0KxGAaEhI4ZH3RsNrdn4uiBjGq9E3j60=mo,2³4⁵89% we ruo}adhk*xc :!?² 😒🧐😏😛🤐😐🤤☺️🥲😃😭😂😁🚘🌊💧🐬📀🖨️🚿🚽💧🌽²3355⅚67⁸⁹0,1,0,,2025-09-27 18:02:42,,,
b5a15455-051e-4834-a81b-51a312e9fa6b,Muh Mahdi,https://play-lh.googleusercontent.com/a-/ALV-UjWNoznMZLV7yPy1ZV129zQFlnsY_DVDlrJqLzzJ0MWArlkpATE,Jelek,1,0,,2025-09-27 16:50:45,,,
dc4ad17e-7769-441f-bfa0-8b41e249a0e9,Maya Febriyani,https://play-lh.googleusercontent.com/a-/ALV-UjWbHgTuJwGNZbkNpdTMYMLEXdc-h8IAmsxOt0vfyzpREBHGDYk,KECEWA,1,0,25.09.08.1,2025-09-27 13:42:52,,,25.09.08.1
ac343ae6-a2e3-4ea1-a8b3-f8821c9310e1,Des Wendi,https://play-lh.googleusercontent.com/a/ACg8ocLWXLVW1X_yukqia78GxnU-3CYOMn-1PlPUisaaO60FFF24mQ=mo,"TIDAK BISA LOGIN, APLIKASI BODOH",1,0,25.09.08.1,2025-09-27 11:51:36,"Hai Des, mohon maaf atas ketidaknyamanan yang terjadi. Mohon untuk mengirimkan nomor telepon yang ingin kamu daftarkan, merek, model, versi OS dari perangkat, versi aplikasi, dan foto/video pendek dari kendala ke email kami disneyplus.id@hotstar.com. Terima kasih.",2025-09-27 14:22:27,25.09.08.1
9e94b6ce-e1e5-46db-bb24-a13adfd5ac48,RIAN Gea,https://play-lh.googleusercontent.com/a/ACg8ocLFyLfI6ijVlpZmQTgU6p5b-tDoC2hh6t95q8jd8gcJn5Psbg=mo,tolonglah untuk bug nya diperbaiki karena saya lagi nonton ini nggak bisa-bisa karena loading terus plus layarnya hitam ini nggak memulai tolong diperbaiki ya,3,3,25.09.08.1,2025-09-26 19:35:34,"Hai Rian, kami mengerti atas ketidaknyamanannya. Mohon kirimkan rinciannya disertai nomor telepon terdaftar di Disney+ Hotstar, foto/video pendek kendala, nama konten, nama provider internet, merek, model & versi OS perangkat, dan versi aplikasi Disney+ Hotstar kamu ke email disneyplus.id@hotstar.com untuk bantuan lebih lanjut. Terima kasih.",2025-09-27 16:48:45,25.09.08.1
dba85820-e263-4fd1-9bda-738d128a3200,AA SINCHAN,https://play-lh.googleusercontent.com/a-/ALV-UjUXGkAnApR2qfgZtAUsbNw_SWI3XeCR-R-jn9KZtJMuwva3IhCX,mau berlangganan ribet amat. pembayaran nya harus pake gopay sama kartu kridit.,1,1,25.09.08.1,2025-09-26 17:19:51,"Hai, Kami mohon maaf atas kendala yang dialami. Terkait dengan kendala saat pembayaran, silakan kirimkan rinciannya melalui email ke disneyplus.id@hotstar.com disertai dengan nomor telepon, metode pembayaran yang digunakan, dan foto kendala yang dialami, agar dapat kami periksa. Terima kasih.",2025-09-27 15:34:56,25.09.08.1
72fd32fa-1539-485b-91b0-0e0df215052b,Johari Johari,https://play-lh.googleusercontent.com/a-/ALV-UjXB4dQ7tV5dOQ794ziwYBca0ms6orQFcfvBsxOzFnsRK39nsyA,sangat bagus,5,0,,2025-09-26 16:32:38,,,
1b3ecb82-af0b-4b07-bc94-c9b082e7865e,Junaidi Junaidi,https://play-lh.googleusercontent.com/a-/ALV-UjVSx67Au9AL3JTKySpBtNvAXRr4BZ1AokDjxXOlVcHXkUKizOg,Acara bagus tapi perlu varias,4,0,23.09.11.19,2025-09-26 11:40:14,"Hai Junaidi, mohon maaf atas ketidaknyamanannya. Kamu dapat mengirimkan nomor telepon berlangganan Disney+ Hotstar, merek & model perangkat, versi OS, versi aplikasi, video pendek dari kendala, konten, dan nama provider ke email kami di Disneyplus.id@hotstar.com. Terima kasih.",2024-06-09 15:31:00,23.09.11.19
6a2706b6-eb2c-44bc-bd95-09363bcd1ada,Fahrur Untung,https://play-lh.googleusercontent.com/a/ACg8ocL3230A3J3HyehAGoQHJm69PPEYL31cZkHDHHhWFhF0Croqdg=mo,Pantes aja Rating Jelek Gak Rekomen Banget dah,1,0,,2025-09-26 10:52:57,,,
1d1505c5-4725-4447-8d99-71e2b19392f1,Riski Hanifah,https://play-lh.googleusercontent.com/a/ACg8ocJu7Fq4A9blGC71woc5q2e-pOx-9mVQQw20rHmbxV-O8GFPrQ=mo,ok,5,0,25.09.08.1,2025-09-26 03:26:55,,,25.09.08.1
6a2cb085-3937-473c-a411-3b018854057e,WIN AJA,https://play-lh.googleusercontent.com/a/ACg8ocJKTxQl76IOSNw0KXeaG6mo7JKyU0jfyaI4AgzoFpY0Yu6-8w=mo,sudah saya batalin langganan masih aja ngambil gopay gua otomatis. sial.,1,0,25.09.08.1,2025-09-26 00:30:10,"Hai Win, kamu dapat mengirimkan rincian kendala kamu disertai nomor telepon yang terdaftar di Disney+ Hotstar dan bukti pembayaran atas langganan dan pastikan dikirim ke email Disneyplus.id@hotstar.com. Terima kasih.",2025-09-26 16:32:21,25.09.08.1
d0c17fd8-3cb0-40ec-9d60-e71a090a46e1,Gregory Thines,https://play-lh.googleusercontent.com/a-/ALV-UjUWN0N-S1fT1SIEIGBk856Tl78peIwYTf6qu6C2MZBNJTrGLa8,"good, upgrade the services and video quality and lotsa movies",5,0,,2025-09-25 22:21:23,,,
187d50d6-a533-495d-8175-1fa92e5f42bc,Agung Wahyu Dwi Santoso,https://play-lh.googleusercontent.com/a-/ALV-UjUMEK9T8nSscfIMz1LUlJyM8pu9rf7zBNSGhp_XOmwhL4ft64Q,"tiba tiba layar ngeblank, hanya layar hitam ga ada visualnya hanya ada subtitle dan suara aja",5,1,25.09.08.1,2025-09-25 16:55:21,"Hai! Kami mohon maaf atas ketidaknyamanannya. Agar kami dapat membantu melakukan pemeriksaan, mohon email ke disneyplus.id@hotstar.com disertai dengan nomor telepon yang terdaftar di Disney+ Hotstar, merek, tipe & versi OS perangkat, versi Aplikasi Disney+ Hotstar, foto kendala, dan nama provider jaringan internet yang di gunakan. Terima kasih.",2025-09-23 15:45:50,25.09.08.1
220d0870-6086-42f1-8b0f-37009844c811,mohammad farhan,https://play-lh.googleusercontent.com/a-/ALV-UjXSKXbvo6EMYSYJxH0NDGSDbNZvcPoL4EZTwPHiuywwh9M6NM7xUg,kasih bintang 2 karena pas nonton kok tiba2 layarnya hitam semua yak padahal internet nya lancar,2,0,25.09.08.1,2025-09-25 15:52:10,"Hai! Kami mohon maaf atas ketidaknyamanannya. Agar kami dapat membantu melakukan pemeriksaan, mohon email ke disneyplus.id@hotstar.com disertai dengan nomor telepon yang terdaftar di Disney+ Hotstar, merek, tipe & versi OS perangkat, versi Aplikasi Disney+ Hotstar, foto kendala, dan nama provider jaringan internet yang di gunakan. Terima kasih.",2025-09-26 16:52:02,25.09.08.1
e878baac-b42b-473c-b162-938ac1c2815f,Susanti Novitadewi,https://play-lh.googleusercontent.com/a-/ALV-UjXo9nZ_7znJvAAcLDGyEyCRCFH7uuvEe5KVN4tpAebJPm-1DSmM,biasakan dibaca dan perbaiki kesalahan ..ini yg jawab otomatis mesin tapi ga diperbaiki,2,0,,2025-09-25 14:30:39,,,
4cbe994d-86a7-42e9-91b5-d613cfd4e39f,aditya warman,https://play-lh.googleusercontent.com/a-/ALV-UjXqSKUyyFnNxDwiBSOGC4S5jCV2nNWhHQEoxMH9p3Sz3ymX6aZ6,nyesel bngt bayar premium bug gambar hilang,1,0,25.09.08.1,2025-09-25 11:20:05,"Hai! Mohon maaf atas ketidaknyamannya. Mohon kirimkan email kepada kami di disneyplus.id@hotstar.com dengan nomor ponsel langganan kamu, detail perangkat (make / model), versi OS & versi aplikasi, nama konten dan tangkapan layar dari kendala yang dialami sehingga kami dapat membantu kamu. Terima kasih.",2025-09-26 14:17:07,25.09.08.1
93438e12-ee94-408a-b142-33a0fa88455b,Muhammad Sandiokta Nakhami,https://play-lh.googleusercontent.com/a-/ALV-UjUqagIRB7s9UV1WfzIr6elhdbcUCbRD51xpR9T0Qs4ql5-GqBPq,gak jelas nih kok layar item sih? gak muncul videonya cuman audio aja,1,0,25.09.08.1,2025-09-25 00:40:14,"Hai, mohon maaf atas ketidaknyamanannya. Mohon kirimkan email kepada kami di disneyplus.id@hotstar.com dengan nomor telepon langganan kamu, detail perangkat (merek, model & versi OS), versi Aplikasi Disney+ Hotstar, nama konten, nama penyedia jaringan internet, dan video pendek kendala yang dialami sehingga kami dapat membantu kamu. Terima kasih.",2025-09-25 14:30:00,25.09.08.1
64012a43-3bc4-4ce0-8927-2df353de6269,ferry mardian,https://play-lh.googleusercontent.com/a-/ALV-UjUmqQVID_3egD4kGJLAhNw_ySUWD6pGbco0QGXVogm2PceCgsnK,Good Jobs...👍👌,5,3,25.09.08.1,2025-09-24 23:53:05,,,25.09.08.1
e2e30b29-36f8-4dbc-81f1-695cc85d5603,Endang Mahulette,https://play-lh.googleusercontent.com/a/ACg8ocJq6IMtOrx8IJtdt0gL-hBohY9dVn_z47sK6wQD8zQkhiRvCg=mo,sudah langganan tapi tidak bisa nonton,1,0,25.09.08.1,2025-09-24 17:12:33,"Hai Endang, mohon maaf atas ketidaknyamanannya. Kamu dapat mengirimkan nomor telepon berlangganan Disney+ Hotstar, model perangkat, versi OS, versi aplikasi Disney+ Hotstar, video pendek dari kendala, bukti pembayaran & nama provider ke email kami Disneyplus.id@hotstar.com. Terima kasih.",2025-09-25 13:51:49,25.09.08.1
706f2022-9548-4d06-a1dd-228788211adc,sier Wati,https://play-lh.googleusercontent.com/a-/ALV-UjXSyHyM2r2OUdL9eKDRO1tpmkm_lUDzp8M_ppRdMmCL2izCPTrQ,kenapa sekrng mahal bgt,1,0,12.3.1,2025-09-24 13:10:40,,,12.3.1
afce82fa-113a-420e-be61-f7fa068b7b35,Muhammad Hazbi,https://play-lh.googleusercontent.com/a-/ALV-UjUi5i8XQzGj7w1-FHuMVMGGhTQldk_TRELM0dU3BfRudWv4ziQ7,saya setiap mau nonton selalu full hitam gambar nya (tidak ada gambarnya) tolong perbaiki,1,0,25.09.08.1,2025-09-24 09:49:30,"Hai Hazbi, kami mengerti atas ketidaknyamanannya. Mohon kirimkan rinciannya disertai nomor telepon yang terdaftar di Disney+ Hotstar, foto/video pendek kendala, nama konten, nama provider internet, merek, model & versi OS perangkat, dan versi aplikasi Disney+ Hotstar kamu ke email disneyplus.id@hotstar.com untuk bantuan lebih lanjut. Terima kasih.",2025-09-24 17:02:08,25.09.08.1
a2a11bd6-b67f-4c25-a924-24f5734ffb18,Qween Birbir,https://play-lh.googleusercontent.com/a-/ALV-UjUmexAwcH2sUqMpYrSMGVM58TXGoH0loStYbo7ZlvjwXxb727exIg,"di android tv nonton film seri gak bisa otomatis lanjut ke episode selanjutnya ,, harus manual pake remote ,,, bikin repot , mending pindah app lain kalo gitu , gak praktis",2,0,,2025-09-24 07:39:31,"Hai, mohon maaf atas ketidaknyamanannya. Kamu dapat mengirimkan nomor telepon berlangganan Disney+ Hotstar, merek & model perangkat, versi OS, versi aplikasi, video pendek dari kendala, judul konten, dan nama provider internet ke email kami Disneyplus.id@hotstar.com. Terima kasih.",2025-09-24 14:04:51,
5963a28d-ca72-47b0-9599-f1c8dea0857a,Nonton yutbe,https://play-lh.googleusercontent.com/a/ACg8ocKVBO_fEpvp-aOpVGMi7iZLtPVvtTjdPnu97JKLokdiSnuzKg=mo,ngapain dah ngabisin saldo buat nonton yang bayar kalo ada yang gratis dan sama sama lengkap konyol hanya sdm rendah dan bodo nonton bayar,1,0,,2025-09-24 05:01:49,,,
306c6494-71fd-4593-ba87-3a67941cb403,Steven Valianto,https://play-lh.googleusercontent.com/a/ACg8ocJh4eadlRcZX6aopZIXggwogPyy5kKR1RR64pwD7QvVEGR3gQ=mo,mantap,4,0,25.09.08.1,2025-09-24 00:33:11,,,25.09.08.1
9474b924-175c-45c7-8c3f-11b3db8bb65d,Valianto Dharma saputra,https://play-lh.googleusercontent.com/a/ACg8ocIe8wN11SlcOVg8-vQyZBhFT0bPzks77O40vuVZPRaMyD1b7A=mo,mantap,4,0,25.09.01.1,2025-09-23 23:58:07,,,25.09.01.1
921e81f1-048f-4aad-92d8-4944802b9bdb,ymr,https://play-lh.googleusercontent.com/a-/ALV-UjVuZ9N4d8mMVufrPo7qYDPC5g3ITpMvVohw1cPp-Z8DVrF9Bnbm,"zionis Kapitalis tolol maruk, mahal' bayar langganan kualitas ampas, bug terus...",1,0,25.09.08.1,2025-09-23 23:07:47,,,25.09.08.1
