reviewId,userName,userImage,content,score,thumbsUpCount,reviewCreatedVersion,at,replyContent,repliedAt,appVersion
d4cab133-c2de-4c17-9efb-8a1dbd794495,Opin Jangkrik,https://play-lh.googleusercontent.com/a-/ALV-UjVD6lpPZiwKefB4tTnAuB5VyB2l_QlMq_y_UQ1idylDcNMbZiY,"Filmya bagus, harganya lebih murah daripada sebelah, Beli Paket yg 1th, sebulan make lancar, giliran bulan ke dua pas di buka aplikasinya tau2 ada notif ""Anda menggunakan VPN"" Lah kocak, padahal punya VPN juga enggak,apalagi make VPN, sampe sekarang nggak bisa dibuka, gajelas banget.",1,1,12.4.7,2022-12-21 18:08:34,"Hai Opin! Kami mengerti atas ketidaknyamanan yang kamu alami. Kelihatannya jaringan internet kamu terhubung ke server luar negeri. Terkait hal ini, mohon kirimkan nomor telepon berlangganan dan nama penyedia jaringan internet kamu ke email disneyplus.id@hotstar.com untuk bantuan lebih lanjut. Terima kasih.",2022-12-22 15:24:04,12.4.7
162661d0-3584-46ae-9671-96b9c9fd6427,Novi Novi,https://play-lh.googleusercontent.com/a-/ALV-UjVHCNqaClQxVf4isnc1y5wK2vD6yHLB6Ik5JLdCLRQ_stQ9gzEZ,Pakai Disney sudah 2 tahun tapi ini ada apa malah suru bayar lgi. Kirain cuma sekali bayarnya,1,0,12.4.7,2022-12-21 15:50:32,,,12.4.7
4848a701-b8f2-46c7-a0ef-522a822eb437,arsyila aziz,https://play-lh.googleusercontent.com/a/ACg8ocIFF9aRwAMtEt8DsXrsfs2KDr33AeTvqWWL2S3MJCGSNIEMyg=mo,"Error pl 1001 gak bisa muter film, padahal udah berlangganan, sia2 uang gue",1,0,,2022-12-21 13:52:23,"Hai, mohon maaf atas ketidaknyamannya. Mohon kirimkan email kepada kami di disneyplus.id@hotstar.com dengan nomor terdaftar kamu, detail perangkat (make/model), versi OS & aplikasi, dan tangkapan layar dari kendala yang dialami agar kami dapat membantu kamu. Terima kasih.",2022-12-22 14:33:08,
f6149f5b-5191-4e6b-8ffc-314962bb2ecf,Tio Charles,https://play-lh.googleusercontent.com/a-/ALV-UjUphWz1sUPZxuFWSywqtkTBxfukEqfCQvzpTmuXSZV7-HTyDj8,"Sejak update , video tidak bisa diputar sama sekali di S6 tab , di hp bisa putar , sudah infokan semua hal yg diminta cs disney bernama putri namun tidak ada balasan atau solusi . Biasanya nonton lancar di tab S6",2,25,12.4.9,2022-12-21 13:21:31,,,12.4.9
c6050a25-673b-4f84-b8c8-9099239a94e6,Sean Lesley,https://play-lh.googleusercontent.com/a-/ALV-UjW6ZtxJN3NB7JJb2UaD4NV7uN5mAPTMA5ynFamtg1XjVGouc3Oc,"Video qualitynya gak berfungsi, udah atur ke kualitas tinggi tetep burem banget",2,0,12.4.9,2022-12-21 10:11:00,"Hai Sean , kami memohon maaf atas ketidaknyamanan yang dialami. Silahkan email kami di disneyplus.id@hotstar.com disertai info perangkat yang digunakan (jenis/model), versi OS dan screenshot kendala (jika ada) agar kami dapat menindak lanjutinya. Terima kasih.",2022-12-22 14:20:35,12.4.9
97aa89a8-cb43-4ee3-a290-c8d4bd8ee8cb,BUDI TASMAN,https://play-lh.googleusercontent.com/a-/ALV-UjX2taleKIPcHk-LpAKqwHDEDPz2sXr-bWDJeVEtL1l5uGtp7J-H,Movie action,5,0,12.4.7,2022-12-21 09:02:45,,,12.4.7
b273810c-c9bc-465f-a483-2e23e2d7834e,Ayif Fathurahman,https://play-lh.googleusercontent.com/a-/ALV-UjW6ERvSyfvFXYiN8aGMmVuQFyhh2MblbryWT0gijfU4JxuH2Oo,amphibia 4 episode lagi lama banget updatenya padahal udah tamat,5,0,12.4.7,2022-12-21 07:42:03,,,12.4.7
5d6e5916-780a-4630-bf56-510504db1859,MU'AENI,https://play-lh.googleusercontent.com/a-/ALV-UjX8biHtLn2fg1Zyxz5kNOUr6RAuAevUGSbE6xPMP4qBir6dNTeJ,"Cara Telkomsel meraih keuntungan yaa dengan nipu. Udah beli kuota multimedia tapi tetap gabisa di pake, yg kepake malah kuota utama. Setelah kuota utama habis udah gitu aja gabisa nonton lagi, terus kuota multimedia nya buat apa? 🙂🙂",1,7,12.4.9,2022-12-21 05:51:13,,,12.4.9
f41727d2-ad87-4adb-be54-9ca054ce7d7c,Daffa Alif,https://play-lh.googleusercontent.com/a-/ALV-UjUoqYftgZwBb8vl0fUbt2NfFcExnPtV4gpOge7V9u_0woAnBSHg,Dri kemarin ga ada spiderman no way home..,3,0,12.4.9,2022-12-20 21:22:58,"Hai, kami mengerti ketertarikan kamu akan konten ""Spiderman No Way Home"". Terkait dengan hal ini, kami telah menyampaikannya kepada Tim terkait Disney+ Hotstar untuk dapat ditinjau. Sementara itu, kamu dapat menonton konten-konten film dan serial lainnya yang tersedia di Disney+ Hotstar.",2022-12-22 14:50:25,12.4.9
dd42db55-1950-4b00-b67c-6aa12d307032,Akbar Ma'arif,https://play-lh.googleusercontent.com/a/ACg8ocLl785mUFSALijjrscp0BVQM3zRsuycQDDCRsjmuW9dmvs3nqM=mo,"while watching the resolution often changes to low, please fix it",1,0,12.4.7,2022-12-20 16:30:05,"Hi Akbar! There are 4 streaming quality settings available - Auto, High, Medium, and Low. Click on the Settings icon after you start playing the video to select from the options available. Thank you.",2022-12-22 14:16:54,12.4.7
7f1cf509-c82e-42d5-9280-ac2875dc898f,Dava Nur Saputra,https://play-lh.googleusercontent.com/a-/ALV-UjWYZX6mDCWCMbad2tgaDzKUA_1FhJwfW8H2ed_wJENlLJWAAaXW,Saya tidak dapat memasuki aplikasi dan loading yang sangat lama dengan jaringan internet yang lancar,2,0,12.4.9,2022-12-20 13:40:37,"Hai Dava, kami mohon maaf atas ketidaknyamanannya. Mohon informasikan kepada kami rincian kendala kamu melalui email di disneyplus.id@hotstar.com disertai nomor telepon kamu yang terdaftar, merek/tipe/model dan versi perangkat, versi Aplikasi Disney+ Hotstar, foto kendala dan jaringan yang kamu gunakan. Terima kasih.",2022-12-20 15:57:40,12.4.9
9d009d8b-051b-4ac9-898b-67ca3d80e921,Rijik Abdilah,https://play-lh.googleusercontent.com/a/ACg8ocKXMUEPzaT6T7y6XhzlKIHn3SEWioPUEJ3NB8iQZK-z8av-IA=mo,Oke,5,0,12.4.7,2022-12-20 13:35:09,,,12.4.7
d3e41ca1-12b5-4d0d-b501-20925c8f2761,Tiger Clan Yogyakarta,https://play-lh.googleusercontent.com/a-/ALV-UjVIfcxWhP22PAPBvM_rcdqfpNWMm9uyEeliI0Y2S_bSSS4TLl0,"Burik, dibuka keluarnya UPSS...matamu",1,0,12.4.9,2022-12-20 12:35:18,,,12.4.9
81f02256-35a0-4e6f-b61d-5b64a30a1ba0,jammie jam,https://play-lh.googleusercontent.com/a-/ALV-UjWmHRAGl6FKpZmjpxZ-a8aDRoi9Y36J5sijl09dlltazhk551bDOg,Kenapa gabisa login ke tv ya?,1,0,12.4.7,2022-12-20 12:33:51,"Hai Darin, kami sangat menyayangkan atas kendala yang kamu alami. Terkait hal ini, mohon untuk mengirimkan email ke disneyplus.id@hotstar.com disertai dengan nomor telepon berlangganan, model/tipe TV dan versi OS yang digunakan, versi aplikasi Disney+ Hotstar kamu, foto/video pendek kendala dan nama penyedia jaringan internet kamu. Terima kasih.",2022-12-20 16:26:59,12.4.7
a41a55cd-ce05-4a1c-ae67-eac944b18152,Rina Ariyani,https://play-lh.googleusercontent.com/a/ACg8ocKq2Ggrsv7PglzdoACwzzyGPLIIMQ-1vVXLYbulgM_Ft35yMA=mo,Bagus banget aku suka,5,0,12.4.9,2022-12-20 12:02:50,,,12.4.9
08eff01a-26e5-4dc6-893c-075653f2d594,Heru Dwi pramono,https://play-lh.googleusercontent.com/a-/ALV-UjVIKu-EZmPnXvUx-E1reEp5yBYgp3930W9TkWKGgjOmjRF3fiyGLw,Harus di tambahin fitur buat masuk code ke tv biar kayak apk sebelah,5,0,12.4.7,2022-12-20 09:52:19,,,12.4.7
da90585e-5ea4-4084-932c-37b4ee119627,Hafidz Aesar,https://play-lh.googleusercontent.com/a-/ALV-UjWFLAtwa3XQAg5Vco63Tjyv9Jq38x8Ar2Uea5hwZ-ir-lhb6paKqw,Keren,5,0,12.4.9,2022-12-20 08:27:28,,,12.4.9
14a392b2-95a9-44a9-a89c-5cb08c5a9582,Unknown Bob,https://play-lh.googleusercontent.com/a/ACg8ocLe7YGiz3oiKs6rXSP94-ggvIK0GL3z-PpPeNZomCNx9AYN4w=mo,Ok,5,0,12.4.7,2022-12-19 21:27:12,,,12.4.7
d1934c77-e940-4598-8d31-fa3ac3c974e0,Alexa Wen1313,https://play-lh.googleusercontent.com/a/ACg8ocJRtoCgZ7Ecza6oUDo3_rBJboVlHuspVSryT795BpWq5v_Y0g=mo,"Udah langganan malah bug, ga bisa nonton.. Kyk nipuu aja",1,0,,2022-12-19 18:50:29,"Hai Alexa, mohon maaf atas kendala yang dialami. Terkait dengan kendala saat nonton, silakan kirimkan rinciannya melalui email ke disneyplus.id@hotstar.com disertai dengan nomor telepon, merek/tipe & versi OS perangkat, versi aplikasi, judul konten, foto dari kendala, dan nama provider jaringan, agar dapat kami periksa. Terima kasih.",2022-12-20 16:49:08,
ab1594a6-f12a-4c4a-8152-ae1653e5fa4c,Wahyu Razwi,https://play-lh.googleusercontent.com/a/ACg8ocLZYqePKzxzQhs_mz2JODn6rQsnKQYpjDLij0hBrMTVweOwMg=mo,"Kadang error, kadang buat hp ngeframe , kadang loading doang lama, hadehhhh",1,0,12.4.7,2022-12-19 17:26:44,"Hai Wahyu, kami mohon maaf atas ketidaknyamanannya. Untuk bantuan lebih lanjut, kamu dapat kirimkan nomor telepon berlangganan, perangkat (Merek & model), versi OS, foto/video pendek dari kendala, provider, dan versi Aplikasi Disney+ Hotstar via email di disneyplus.id@hotstar.com. Terima kasih.",2022-12-22 14:19:54,12.4.7
99277ee1-46c3-4c25-bb50-5a65b2176275,BIORNO Bio,https://play-lh.googleusercontent.com/a-/ALV-UjUsTtG3G7Jcd3x_2C4HozQTYXicBrDw02-C4xWIcwU3tBTBexFS,"Fitur nya sangat sedikit sesimpel ngasih judul film di beranda aja nggak ada, mengunduh di kartu eksternal juga nggak ada",1,0,12.4.7,2022-12-19 03:04:12,,,12.4.7
c9beeb32-b6cf-4a8f-87e9-3b1cfe06dde2,idris fauzi,https://play-lh.googleusercontent.com/a-/ALV-UjW9HnYE_9M0_FiN2oDp89rqNbjGCnPNQkaMTrA4fKxkIB9nu4-2,"Kalau ga niat buat apk, please hapus aja. Bikin rusak HP, gimana developerny ini?!?!? Rusak parahh,, HP gw blank 1 jam sat😕",1,0,,2022-12-18 21:04:25,,,
a2dcb167-56d1-4b3a-a7ad-3b0cedd260ab,abi dave,https://play-lh.googleusercontent.com/a-/ALV-UjXDDqMKtWvWzxlcP765Bz0CrgOZIXSXnD7xo4lcF02cuVC64fI,kenapa saya tidak bisa login ke tv android box,2,3,12.4.7,2022-12-18 20:43:50,"Halo Abi, terkait pertanyaan kamu dapat menikmati pengalaman layar lebar di Apple TV, Android TV, LG TV dan Chromecast. Untuk bantuan lebih lanjut kirimkan email kepada kami di disneyplus.id@hotstar.com. Terima kasih.",2022-12-19 14:17:55,12.4.7
69fff630-47aa-476e-85a1-d329616a4ee1,Maela sari,https://play-lh.googleusercontent.com/a-/ALV-UjV0INAGiFnXIK-9q-IvegDvwG4GUg7dSYRe-YDlVfBU_jJ9Lnq1,Coba subtitle nya dibawah semua. Jangan atas bawah bikin sakit mata,2,0,12.4.9,2022-12-18 20:38:11,,,12.4.9
503d2ee3-c355-4989-b30d-759453fe474f,Morbius93 Morbius93,https://play-lh.googleusercontent.com/a/ACg8ocJ9iNqstp7cVZ9fc9YB4XBJp-ltdPFs08UMrikvy4aIWa0bqQ=mo,Tolong diperbaiki setingan full screen untuk tablet,1,0,,2022-12-18 20:20:14,"Hi, kami memohon maaf atas ketidaknyamanan yang dialami. Silahkan email kami di disneyplus.id@hotstar.com disertai nomor berlangganan, info perangkat yang digunakan (jenis/model), versi OS, dan screenshot kendala agar kami dapat menindak lanjutinya. Terima kasih.",2022-12-19 14:19:03,
e614e86e-98eb-4962-a85a-7db44fa56137,Diva Rahma,https://play-lh.googleusercontent.com/a-/ALV-UjXZiYbKyohi1qwnQ1CHXHre5WZU6WdAXpXbPZ0kz0IW_WyPjjR2,Baguss... aplikasi legal yang lengkap film Marvel,5,0,,2022-12-18 19:45:57,,,
ec32933f-c0af-4e87-b4dd-19ee768dbf56,Auliany Ashilah Daulay,https://play-lh.googleusercontent.com/a-/ALV-UjXCiGujL4T44Hkw3X9gZ8UvljlaVKupFITaY3oi-BTkhE5KCnDW,"Aplikasinya kok jadi gini sih, biasanya aman2 aja selama make. Tampilan home jadi chanel2 india trus Tolong segera diperbaiki 🙏",2,0,,2022-12-18 19:25:56,"Hai! Agar kami dapat membantu, mohon kirimkan email kepada kami di disneyplus.id@hotstar.com berisikan nomor telepon yang terdaftar dan nama provider jaringan yang kamu gunakan serta merek dan OS perangkat yang kamu gunakan dan foto kendala yang kamu alami. Terima kasih.",2022-12-19 14:21:01,
173a29f8-9e4a-49fa-af6c-970eb6c8ea99,J D,https://play-lh.googleusercontent.com/a/ACg8ocKfVta_e0VcYByaC4OpTqPphIUy7BKmnnnGeSz2HA37UpFdwBs=mo,Aplikasi ni sangat bagus,5,0,12.4.7,2022-12-18 18:04:30,,,12.4.7
0af9dfe2-0a9e-4da4-ab92-608df1e6d25c,Yanuar Muharamsyah,https://play-lh.googleusercontent.com/a/ACg8ocIlMSsgg5xKSGY_vSU6Lx4ilVtZxC63NbTtUXh4HdJuLNhzwQ=mo,Banyak bug video ga bisa diputar loading mulu padahal jaringan bagus,2,0,12.4.7,2022-12-18 18:00:30,"Hi, kami memohon maaf atas ketidaknyamanan yang dialami. Silahkan email kami di disneyplus.id@hotstar.com disertai nomor berlangganan, info perangkat yang digunakan (jenis/model), versi OS dan screenshot kendala (jika ada) agar kami dapat menindak lanjutinya. Terima kasih.",2022-12-19 14:14:29,12.4.7
3fa406bf-2c1b-43ec-baa1-07f5d89ca79c,Ariyo Bagus,https://play-lh.googleusercontent.com/a-/ALV-UjVkZOfSipeNh3NqqrVtaTn6y7DW0YlkGow3PXYpBH5OtqzOWMAf,Terlalu banyak serial LGBT..,2,1,12.4.7,2022-12-18 17:45:27,,,12.4.7
e94408aa-05b3-459f-8d2e-e02ccc05651e,Alan Humble,https://play-lh.googleusercontent.com/a/ACg8ocKtEmEhilPtDC9Evg_9uiIaJZzu_6O2l1NQqu7-6XqQCdnkhQ=mo,S3ngaja saya kasih bintang 1,1,0,,2022-12-18 15:27:58,,,
9c949203-d2f0-42cd-a25b-3c5cfeb6ff3f,Muhammad Iqbal,https://play-lh.googleusercontent.com/a/ACg8ocKZw9LEi75gqw4n0ClGT7Ha8MB54WW5x-3fOmDs_VdN0_wWuPc=mo,Saya tidak suka. Dikerenakan tidak ada film perang.saya suka film perang perangan namun ini kurang lengkap:F,2,0,12.4.9,2022-12-18 14:34:52,"Hai Iqbal, kami terus meninjau penawaran konten kami untuk memberi kamu pengalaman terbaik. Kami telah menyampaikan permintaan kamu kepada tim konten kami. Sementara itu, silakan nikmati konten lainnya yang saat ini tersedia di Disney+ Hotstar. Terima kasih.",2022-12-19 14:18:46,12.4.9
81c767da-1416-4338-9147-9dd951a67711,ridho Adi pratama,https://play-lh.googleusercontent.com/a/ACg8ocI3mj7SKHFASOEqCPU7ROPwfxgMpgb0McC1qfwaSeSbXQSdMw=mo,aplikasinya bagus tapi sayang film kartunnya kurang lengkap,3,0,12.4.7,2022-12-18 14:16:26,,,12.4.7
a5e9a7bc-4e5e-4c61-8edf-839165c6b597,Bagoes sasmbodo,https://play-lh.googleusercontent.com/a-/ALV-UjU5mSU7J--qAfchqXkKwlHG19Qs5XMrsSR1Cqi9c3ouNiZSQjNS,"Sekarang lebih buruk,sya berhenti lngganan saja",1,0,12.4.9,2022-12-18 13:58:29,"Hai Bagoes, kami memohon maaf atas ketidaknyamanan yang kamu alami. Terkait hal ini, mohon informasikan secara detail kepada kami di email disneyplus.id@hotstar.com disertai dengan nomor telepon yang terdaftar dan bukti pembayaran agar kami dapat membantu kamu lebih lanjut. Terima kasih.",2022-12-19 15:02:24,12.4.9
513911cf-ac08-46f7-92d3-a1ba0984bd6e,lollipop blackwhite,https://play-lh.googleusercontent.com/a/ACg8ocJRBbmjO3A-E7oG-5BtPcTT8tYQNL-hkATDgd_TO-f6GHbaRw=mo,"Pemotongan tanpa diberitahukan, aplikasi sialan",1,0,,2022-12-18 13:32:25,,,
506ef339-95e8-4092-9003-12dd89a822d7,Dzumaliyah,https://play-lh.googleusercontent.com/a/ACg8ocLb8_CUxQuZLQZSq_ysxUSJtTakkcJO4vTvn__qN3XQmCsLL-A=mo,kok gabisa dibuka ya? pasti ada kesalahan trs padahal udh tak uninstall trs download lg tp ttp gabisa dibuka,3,0,12.4.7,2022-12-18 12:12:00,"Hi, kami memohon maaf atas ketidaknyamanan yang dialami. Silahkan email kami di disneyplus.id@hotstar.com disertai nomor telepon terdaftar, info perangkat yang digunakan (jenis/model), versi OS dan screenshot kendala (jika ada) agar kami dapat menindak lanjutinya. Terima kasih.",2022-12-19 14:07:27,12.4.7
23ff8eb9-45cb-43fc-8d09-991d3f017dcc,Oskar Waluyo,https://play-lh.googleusercontent.com/a/ACg8ocI_SAbCnn1WnDA7zuHb2c8Bn2LN7QoGrb1eLePNmxgc4-oMaQ=mo,"Uninstall aja aplikasi tidak berguna, rugi kuota download nih aplikasi. Mau login susah. Giliran dah login malah gak bisa diputar filmnya. Dulu bagus sekarang jeleknya minta ampun nih aplikasi.",1,0,12.0.0,2022-12-17 22:43:11,"Hai! Kami mohon maaf atas kendala yang kamu alami. Agar kami dapat membantu, mohon kirimkan email kepada kami di disneyplus.id@hotstar.com berisikan nomor telepon yang terdaftar dan nama provider jaringan yang kamu gunakan serta merek dan OS perangkat yang kamu gunakan dan foto kendala yang kamu alami. Terima kasih.",2022-12-19 14:13:13,12.0.0
e56dd409-dcdd-489d-942e-94e9b81230f7,Denny S Indriawan,https://play-lh.googleusercontent.com/a-/ALV-UjU_0HXD0FgTm1xt3GRt097rXY02QytW5o5fR1GWStByNgziwxjr,"Black screen saat streaming film, masalah sepertiny ada pada apk ny",2,0,12.4.7,2022-12-17 22:23:14,"Hai! Agar kami dapat membantu, mohon kirimkan email kepada kami di disneyplus.id@hotstar.com berisikan nomor telepon yang terdaftar dan nama provider jaringan yang kamu gunakan serta merek dan OS perangkat yang kamu gunakan dan foto kendala yang kamu alami. Terima kasih",2022-12-19 14:10:48,12.4.7
62cc9c4f-2b87-49bb-8980-60b40ff9e149,Muhammad Fahri Akbar 05,https://play-lh.googleusercontent.com/a-/ALV-UjXjCJUQBjUE_G6_6EixpNpsIOjGqcuJqrGkXiaWUx6LVXx4suWF,"Mengecewakan,mau login ke tv aja harus ke web dah gitu kalau pake hp android ga bakal muncul buat masukin kode ke tv nya ,Masa iya harus pake hp ip/laptop atau PC dulu , MENGECEWAKAN.",2,0,12.4.9,2022-12-17 22:21:40,"Hai Fahri, kami mohon maaf atas ketidaknyamanannya. Mohon informasikan kepada kami rincian kendala kamu melalui email di disneyplus.id@hotstar.com disertai nomor telepon kamu yang terdaftar, merek/tipe/model dan versi perangkat, versi Aplikasi Disney+ Hotstar, foto kendala, jaringan yang kamu gunakan. Terima kasih.",2022-12-19 15:14:41,12.4.9
04f730f5-12df-41a3-a6ea-4607d0aed8de,Trio J,https://play-lh.googleusercontent.com/a-/ALV-UjVFB97UVC6UjjAAjPAISJtP3WdKl2na4zeDZo7-W1cWRhvXIdo,Mantab,5,0,12.4.7,2022-12-17 21:30:54,,,12.4.7
3823483b-6939-4f3d-b74b-8f886d262ba4,Rizky Official,https://play-lh.googleusercontent.com/a-/ALV-UjVGcCUMp_P4D60wTMzKBMY-L2YHkA3iXzMTm096VuCG-0dxGhVN,Uda seminggu ga bisa diputer. Apa apan ini aplikasi segini pake fold Masi aj bug,1,1,12.4.7,2022-12-17 20:54:41,"Hai Rizky, kami mohon maaf atas ketidaknyamanannya. Mohon informasikan kepada kami rincian kendala kamu melalui email di disneyplus.id@hotstar.com disertai nomor telepon kamu yang terdaftar, merek/tipe/model dan versi perangkat, versi Aplikasi Disney+ Hotstar, foto kendala, judul konten dan jaringan yang kamu gunakan. Terima kasih.",2022-12-19 13:57:25,12.4.7
9a888aba-bef0-49ab-96dd-b564fe3eac2d,kadek moyo,https://play-lh.googleusercontent.com/a-/ALV-UjUTwPy7Bp0ytrb1Na_rra_iAuvTeBXcLpTGV21UJMA3PqZqaKfS,Aplikasi error tidak bisa berlangganan,1,0,12.4.7,2022-12-17 19:30:36,"Hai, terima kasih atas ketertarikan kamu terhadap Disney+ Hotstar. Ikuti langkah-langkah pendaftaran di help.hotstar.com untuk membantu kamu mulai berlangganan atau kirimkan email kepada kami di disneyplus.id@hotstar.com untuk bantuan lebih lanjut. Terima kasih.",2022-12-19 14:07:26,12.4.7
10374163-7a6a-4da4-ad5f-e8a7a26bd94a,Ro,https://play-lh.googleusercontent.com/a/ACg8ocKqdUfZTK9zlbziDsYS4_qxw1FdtYhWu5Wfy_9UWAp2iLAYLeI=mo,mau nonton vidio offline malah loading terus hahahah,1,0,12.4.9,2022-12-17 12:38:34,"Hai Farhan, kami mohon maaf atas ketidaknyamanannya. Mohon informasikan kepada kami rincian kendala kamu melalui email di disneyplus.id@hotstar.com disertai nomor telepon kamu yang terdaftar, merek/tipe/model dan versi perangkat, versi Aplikasi Disney+ Hotstar, foto kendala, judul konten dan jaringan yang kamu gunakan. Terima kasih.",2022-12-19 13:55:43,12.4.9
8612ae9c-25ef-462a-b69f-c37f632e995a,Siska Setiyani,https://play-lh.googleusercontent.com/a-/ALV-UjU6mSRjyWzChNNEt3ClbsdV1w8qRcqV6Vl-xbLuegR2FicnDBPt,Mantappppppp.. terbaik pokoknya,5,0,12.4.7,2022-12-17 11:50:09,,,12.4.7
c12f2d4e-7d3e-4edf-ae8e-353886a7c8cf,Agustine Widya,https://play-lh.googleusercontent.com/a/ACg8ocIzAbuep5TMS-auu2mYVnyyKU5-z3-Etu1VGBa-ZTYFEmLkMPiG=mo,Padahal filmnya bagus2 tapi pas mau payment ngga bisa muluu,4,0,12.4.7,2022-12-17 11:41:38,,,12.4.7
5707c677-e1dd-47ee-afe7-f439756bbcee,Munawarah Munawarah,https://play-lh.googleusercontent.com/a/ACg8ocLpzQ_eF7jcpr5BSd_YMMdoqY_6NfpCj5BITVQElwW6gc_-BA=mo,"Saya udah langganan 1 tahun baru mau dipakai dsruh langganan lagi, aplikasi menguras uang ajah, saldo gue terpotong 199.000 tapi aplikasi nggak mau kepakai👎",1,0,12.4.7,2022-12-17 06:51:03,"Hai, silahkan email kami di disneyplus.id@hotstar.com disertai dengan nomor ponsel dan screenshot bukti pembayaran yang terdapat didalamnya nomor rujukan merchant (Merchant ID) untuk kami dapat membantu kamu lebih lanjut. Terima kasih.",2022-12-19 13:53:25,12.4.7
50b53795-cf5f-4049-9040-8353ee4fd11c,Nayla Ollivia,https://play-lh.googleusercontent.com/a-/ALV-UjXux8YHw8GR8GuxPiKvpZm8wiWaX6GsZ5cSbbfEoc94rywXuCzn,Hooh,4,0,,2022-12-17 06:49:24,,,
22fc53b6-21d8-4c75-bba5-7079e0ed5489,Rama Nuryana,https://play-lh.googleusercontent.com/a/ACg8ocK9szp5XopR2ABh3I5RL4wXaM-Bumn2h6ARqy5FCVjKyi-l=mo,Kenapa sih baru setengah nontn langsung bug black screnn ga guna dasar,1,0,12.4.7,2022-12-17 01:20:52,"Hai Rama, kami mohon maaf atas ketidaknyamanannya. Mohon informasikan kepada kami rincian kendala kamu melalui email di disneyplus.id@hotstar.com disertai nomor telepon kamu yang terdaftar, merek/tipe/model dan versi perangkat, versi Aplikasi Disney+ Hotstar, foto kendala, judul konten dan jaringan yang kamu gunakan. Terima kasih.",2022-12-19 13:53:43,12.4.7
1a353804-5caf-424f-9b3e-d83139c3b1a0,Jesslyn Cahyadi,https://play-lh.googleusercontent.com/a/ACg8ocINfdo8xfaGKUj4JjqOLP_vQi8Z7Ic2DFHbFCsLBC_nEVMYVSQ=mo,Keren bisa nonton apa aja tapi sayang gak bisa nonton Harry Potter yaudah lah yang penting seruu😃😃😃 pakek kartu kredit bayarnya ya👍👍,3,0,12.4.6,2022-12-17 00:25:02,,,12.4.6
ffd38cce-5d96-4126-9f48-b3fbdb9bfc2e,goval akbar,https://play-lh.googleusercontent.com/a/ACg8ocJgyseqcNSmbId9FYnijps8GuJtD0pwd1LbZXJSWbOR87sa3w=mo,Sia sia isi shope pay sama pulsa buat langganan tp malah gak bisa,1,0,12.4.7,2022-12-16 23:08:08,"Hai! Agar kami dapat membantu, mohon kirimkan email kepada kami di disneyplus.id@hotstar.com berisikan nomor telepon yang terdaftar dan nama provider jaringan yang kamu gunakan serta merek dan OS perangkat yang kamu gunakan dan foto kendala yang kamu alami. Terima kasih.",2022-12-19 13:59:36,12.4.7
ca0fe7bd-b4c8-4a44-a218-a5119f868f0a,Supian,https://play-lh.googleusercontent.com/a-/ALV-UjUOAlCryjitCeDH_ygQayIhbbPa6E9U5PzDezvOFkG28FplUwEBPw,mantap,5,0,12.4.7,2022-12-16 21:20:34,,,12.4.7
6b79f248-faf4-455f-8225-aaaf42314857,Sri Aidiyati Ningrum,https://play-lh.googleusercontent.com/a-/ALV-UjU9TEbwGL3GE3m2WO5cbUrAm-uVwHsMbbWg4vezjigpSm3UxuI,Aplikasi nya jelek banget film2 yang sudah di download tidak bisa diputar lagi. Minta tolong diperbaiki,1,4,12.4.9,2022-12-16 20:34:47,"Hai, untuk langkah-langkah terperinci tentang mengunduh konten, silakan kunjungi help.hotstar.com atau kirimkan email kepada kami di disneyplus.id@hotstar.com untuk bantuan lebih lanjut.",2022-12-19 13:50:17,12.4.9
0d620f9b-b416-4087-9c8b-864af9bb24be,Dita Anggraini Wibowo,https://play-lh.googleusercontent.com/a/ACg8ocKvzvO5u0G9CbpETJjfgv5XjbU-qQF2C9CBxohz2UmUEzzGkg=mo,"Kenapa ga bisa login, gangguan terus",1,1,,2022-12-16 20:07:16,"Hai Dita, mohon maaf atas kendala yang dialami. Terkait dengan kendala saat log in, silakan kirimkan rinciannya melalui email ke disneyplus.id@hotstar.com disertai dengan nomor telepon, merek/tipe & versi OS perangkat, versi aplikasi, foto dari kendala, dan nama provider jaringan, agar dapat kami periksa. Terima kasih.",2022-12-19 13:51:10,
8063c498-e38b-461e-b501-8ad09d0d90cd,Devdev Afiani,https://play-lh.googleusercontent.com/a-/ALV-UjXsVE9S4aOoTurkazRel1PsM6z-QZPZVQvMnQeAgWdL5RAnthQ,baik,5,0,12.4.9,2022-12-16 19:52:09,,,12.4.9
98851aac-cc2b-41e0-9472-6fcff262e802,Milah Rodiatul,https://play-lh.googleusercontent.com/a/ACg8ocJtArbX7To4xaNf0F3pr0O8QFakV064T-t8GEEj5wKK4xennA=mo,"KESEL BANGET PADAHAL APK NYA UDH DI HAPUS, TAPI MALAH KE POTONG OTOMATIS LANGGANAN NYA.",1,1,12.4.7,2022-12-16 19:51:29,"Hai! Kami memohon maaf atas ketidaknyamanan yang dialami. Agar kami dapat melakukan pemeriksaan lebih lanjut, silakan email kami di disneyplus.id@hotstar.com dengan menyertakan nomor telepon terdaftar dan screenshot bukti pembayaran yang terdapat didalamnya nomor rujukan merchant (Merchant ID). Terima kasih.",2022-12-19 14:22:33,12.4.7
b61118f7-32bf-4a08-8dda-4f39abc05903,WdGH mm Egg bg,https://play-lh.googleusercontent.com/a/ACg8ocI5c8uXE9BsMaRZffqt6DOW0gLzPfFtJFME2bgDrwnXzuKu_g=mo,WWE raw 🙏😥,5,0,12.4.7,2022-12-16 14:07:24,,,12.4.7
c9ffeb11-be99-4c20-aee7-84a8161c7fbd,Ridwan Drajad,https://play-lh.googleusercontent.com/a-/ALV-UjUIwMN0NjAefvdGve13tSjTH9R964MKAs__Ceymp-xe4Ym5R-6B_A,Minta kode OTP berasa lagi ngemis. Udah submit berkali kali tetep gak dikirim.,1,0,12.4.7,2022-12-16 11:35:49,"Hai Ridwan, kami mohon maaf atas ketidaknyamanannya. Mohon informasikan kepada kami rincian kendala kamu melalui email di disneyplus.id@hotstar.com disertai nomor telepon kamu yang terdaftar dan nama provider yang kamu gunakan. Terima kasih.",2022-12-16 14:01:44,12.4.7
89ae4a74-73ce-4a72-a0b9-546d261a8b97,Harris Harto Dininggrat,https://play-lh.googleusercontent.com/a-/ALV-UjXA6_SZVNJMQJUgPaj59YEcJY3WnjKpgU_Q6ANQVYpddExuR2-L,Sons of Anarchy S1 E2 kenapa Error Kode [ERR_PB_1413] Kocak!!! Ok Udh Ter.Atasi MANTAB bintang6,5,0,,2022-12-16 03:37:36,,,
9a9a7434-70f2-498f-b1c9-12674090b93b,Ramadhan Rmd,https://play-lh.googleusercontent.com/a/ACg8ocIo72qgG7CcbSesMuhQnDXR8XmaW5LNgYZWgXtiTq05lfrS6w=mo,"Woi film Titanic kenapa dihapus anjeng!!! Percuma gue langganan, nyesel banget setan Apk sampah! Tau gini mending langganan netflix",1,0,,2022-12-15 22:44:12,,,
71ee17e6-1a3e-4056-b97f-82d0b4b48377,Iman Bhonest,https://play-lh.googleusercontent.com/a-/ALV-UjX8j0b8MLF6G7P3dGFBrxzcoMXnly2OJ4NZZHEfVMIWwSUEnYeb,"Rugi bgt udh keluar duit 39k tapi kaga bisa nnton, malah muter2 mulu film nya kaga jalan. Coba film apapun sama aja cuma muter doang.. tapi kalo trailer nya doang semua film bisa di tonton, sedangkan film nya gak ada yg bisa.. kalo trailer nya aja bisa di tonton lancar kaga mungkin masalah nya ada di kuota atau sinyal.. Rugi bgt bayar mahal cuma buat nnton trailer film.. kalo cuma trailer mah di YouTube juga bisa gratis sepuasnya",1,1,12.4.7,2022-12-15 22:21:38,"Hai Iman, mohon kirimkan email kepada kami di disneyplus.id@hotstar.com dengan nomor ponsel langganan kamu, detail perangkat (make / model), versi OS & versi aplikasi, nama konten dan tangkapan layar dari kendala yang dialami sehingga kami dapat membantu kamu. Terima kasih.",2022-12-16 14:07:26,12.4.7
b8482d23-4011-4791-9a35-5becd9c82b8b,Nona Novi,https://play-lh.googleusercontent.com/a-/ALV-UjVBlFoLIDYC8FPvRLKrMvD9jfgJOOMCX7OB7LDBNQ-IzrlGttfN4g,Makin jelek gabisa di buka filmnya,2,0,12.4.7,2022-12-15 16:19:22,"Hai Novi, mohon maaf atas ketidaknyamannya. Mohon kirimkan email kepada kami di disneyplus.id@hotstar.com dengan nomor ponsel langganan kamu, detail perangkat (merek & model), versi OS & versi aplikasi, nama konten dan tangkapan layar dari kendala yang dialami sehingga kami dapat membantu kamu. Terima kasih.",2022-12-16 13:46:13,12.4.7
